19:51:58.304117 IP 10.20.27.153.59328 > 93.184.216.34.80: Flags [S], seq 2574797435, win 26883, options [mss 8961,sackOK,TS val 689168793 ecr 0,nop,wscale 7], length 0
19:51:58.312402 IP 93.184.216.34.80 > 10.20.27.153.59328: Flags [S.], seq 1050397004, ack 2574797436, win 65535, options [mss 1460,sackOK,TS val 1382375464 ecr 689168793,nop,wscale 9], length 0
19:51:58.312416 IP 10.20.27.153.59328 > 93.184.216.34.80: Flags [.], ack 1, win 211, options [nop,nop,TS val 689168795 ecr 1382375464], length 0
19:51:58.312445 IP 10.20.27.153.59328 > 93.184.216.34.80: Flags [P.], seq 1:39, ack 1, win 211, options [nop,nop,TS val 689168795 ecr 1382375464], length 38
19:51:58.312456 IP 10.20.27.153.59328 > 93.184.216.34.80: Flags [F.], seq 39, ack 1, win 211, options [nop,nop,TS val 689168795 ecr 1382375464], length 0
19:51:58.320753 IP 93.184.216.34.80 > 10.20.27.153.59328: Flags [.], ack 39, win 283, options [nop,nop,TS val 1382375466 ecr 689168795], length 0
19:51:58.321308 IP 93.184.216.34.80 > 10.20.27.153.59328: Flags [P.], seq 1:322, ack 40, win 283, options [nop,nop,TS val 1382375466 ecr 689168795], length 321
19:51:58.321317 IP 10.20.27.153.59328 > 93.184.216.34.80: Flags [.], ack 322, win 219, options [nop,nop,TS val 689168798 ecr 1382375466], length 0
19:51:58.321383 IP 93.184.216.34.80 > 10.20.27.153.59328: Flags [F.], seq 322, ack 40, win 283, options [nop,nop,TS val 1382375466 ecr 689168795], length 0
19:51:58.321388 IP 10.20.27.153.59328 > 93.184.216.34.80: Flags [.], ack 323, win 219, options [nop,nop,TS val 689168798 ecr 1382375466], length 0
